{
  "adapter_protocol_version": "0.1",
  "execution": "completed",
  "execution_batches": [["thermal.domain"],["thermal.material"],["thermal.solve"]],
  "action_reports": [
    {"action_id":"thermal.domain","state":"completed","effects":[],"diagnostics":[]},
    {"action_id":"thermal.material","state":"completed","effects":[],"diagnostics":[]},
    {"action_id":"thermal.solve","state":"completed","effects":[{"subject":{"subject_kind":"entity","id":"thermal.temperature_field"},"quality":"degraded","detail":"backend used an approximate realization"}],"diagnostics":[]}
  ],
  "effects": [
    {"subject":{"subject_kind":"entity","id":"thermal.temperature_field"},"quality":"degraded","detail":"backend used an approximate realization"}
  ],
  "diagnostics": []
}
