{
  "adapter_protocol_version": "0.1",
  "execution": "rejected",
  "execution_batches": [],
  "action_reports": [
    {"action_id":"thermal.domain","state":"not_started","effects":[],"diagnostics":[]},
    {"action_id":"thermal.material","state":"not_started","effects":[],"diagnostics":[]},
    {"action_id":"thermal.solve","state":"not_started","effects":[],"diagnostics":[]}
  ],
  "effects": [],
  "diagnostics": [
    {
      "code":"adapter.precondition_rejected",
      "severity":"error",
      "detail":"current state shows partial prior execution",
      "sol_adapter_protocol_context":{"precondition":"partial_prior_execution"}
    }
  ]
}
